{
  "$schema": "https://json-schema.org/draft/2020-12/schema",
  "$id": "https://9thlevelsoftware.github.io/critter-crafter/schemas/part.v3.schema.json",
  "title": "part.v3.schema.json",
  "type": "object",
  "additionalProperties": false,
  "required": ["schema_version", "part_id", "category", "template", "binding_profile_id", "binding_profile_version", "side", "girth_m", "species_tags", "roles", "status", "dimensions_m", "length_m", "budget"],
  "properties": {
    "schema_version": {"const": "3.0.0"},
    "part_id": {"type": "string", "pattern": "^[a-z][a-z0-9_]*_v[0-9]+$"},
    "category": {"enum": ["core", "limb", "head", "tail", "appendage", "connector"]},
    "template": {"type": "string", "pattern": "^[a-z][a-z0-9_]*$"},
    "binding_profile_id": {"type": "string", "pattern": "^[a-z][a-z0-9_]*$"},
    "binding_profile_version": {"type": "string", "pattern": "^[0-9]+\\.[0-9]+\\.[0-9]+$"},
    "side": {"enum": ["symmetric", "L", "R", "C"]},
    "girth_m": {"type": "number", "exclusiveMinimum": 0},
    "species_tags": {"type": "array", "items": {"type": "string"}},
    "roles": {"type": "array", "items": {"enum": ["core", "locomotor", "manipulator", "detail", "puller", "slither", "connector"]}},
    "size_class": {"enum": ["S", "M", "L", null]},
    "status": {"enum": ["draft", "approved", "rejected"]},
    "style_profile": {"type": "string"},
    "dimensions_m": {"$ref": "#/$defs/vec3"},
    "length_m": {"type": "number", "exclusiveMinimum": 0},
    "budget": {"type": "object", "additionalProperties": false, "required": ["max_triangles"], "properties": {
      "max_triangles": {"type": "integer", "minimum": 1, "maximum": 30000},
      "max_material_slots": {"type": "integer", "minimum": 1, "maximum": 4},
      "texture_size": {"enum": [256, 512, 1024, 2048]}
    }},
    "connector": {"type": "object", "additionalProperties": false, "required": ["radius_m", "span_m", "interface"], "properties": {
      "radius_m": {"type": "number", "exclusiveMinimum": 0},
      "span_m": {"type": "array", "prefixItems": [{"type": "number", "exclusiveMaximum": 0}, {"type": "number", "exclusiveMinimum": 0}], "items": false, "minItems": 2, "maxItems": 2},
      "surface": {"type": "object", "additionalProperties": false, "required": ["method", "voxel_divisions", "fillet_iterations", "bulge"], "properties": {
        "method": {"const": "sdf_grid"},
        "voxel_divisions": {"type": "integer", "minimum": 12, "maximum": 64},
        "fillet_iterations": {"type": "integer", "minimum": 0, "maximum": 8},
        "bulge": {"type": "number", "minimum": 1, "maximum": 1.2}
      }},
      "interface": {
        "type": "object", "additionalProperties": false,
        "required": ["interface_id", "interface_version", "bone_groups", "max_influences", "weights_normalized", "position_m", "rotation_xyzw"],
        "properties": {
          "interface_id": {"const": "skinned_parent_child"},
          "interface_version": {"const": "1.0.0"},
          "bone_groups": {
            "type": "array", "minItems": 2, "maxItems": 2,
            "prefixItems": [
              {"type": "object", "additionalProperties": false, "required": ["group", "role"], "properties": {"group": {"const": "b0"}, "role": {"const": "parent"}}},
              {"type": "object", "additionalProperties": false, "required": ["group", "role"], "properties": {"group": {"const": "b1"}, "role": {"const": "child"}}}
            ],
            "items": false
          },
          "max_influences": {"const": 2},
          "weights_normalized": {"const": true},
          "position_m": {"const": [0, 0, 0]},
          "rotation_xyzw": {"const": [0, 0, 0, 1]}
        }
      }
    }},
    "fallback": {"type": "object", "additionalProperties": false, "properties": {
      "primitive": {"enum": ["capsule", "sphere", "cone", "cylinder", "box"]},
      "albedo": {"type": "string", "pattern": "^#[0-9a-fA-F]{6}$"}
    }},
    "provenance": {"type": "object"},
    "real": {"type": "object", "additionalProperties": false, "required": ["archive_path", "sha256", "fit"], "properties": {
      "archive_path": {"type": "string", "pattern": "^(?![/.])(?!.*(^|/)\\.\\.(/|$))[^\\\\:]+$", "description": "Path of the source mesh relative to the asset archive root, without a leading slash or '..' segments (never copied into this repository)."},
      "sha256": {"type": "string", "pattern": "^[0-9a-f]{64}$"},
      "fit": {"type": "object", "additionalProperties": false, "required": ["axis"], "properties": {
        "axis": {"enum": ["+x", "-x", "+y", "-y", "+z", "-z"]},
        "up": {"enum": ["auto", "+x", "-x", "+y", "-y", "+z", "-z"]},
        "up_fallback": {"enum": ["+x", "-x", "+y", "-y", "+z", "-z"]},
        "straighten": {"type": "boolean"},
        "trim_n": {"type": "array", "items": {"type": "number", "minimum": 0, "maximum": 1}, "minItems": 2, "maxItems": 2},
        "joints_n": {"type": "array", "items": {"type": "number", "exclusiveMinimum": 0, "exclusiveMaximum": 1}},
        "radial_scale": {"anyOf": [{"const": "auto"}, {"type": "number", "minimum": 0.25, "maximum": 4}]},
        "weights": {"enum": ["smooth", "flesh", "jointed", "single", "learned"]},
        "joint_loop_mode": {"enum": ["smooth", "flesh", "jointed", "single"]},
        "mirror_x": {"type": "boolean"},
        "root_center": {"enum": ["slice", "bbox"]},
        "sharp_angle_deg": {"type": "number", "minimum": 0, "maximum": 180}
      }},
      "measured": {"type": "object"},
      "learned_weights": {"type": "object", "additionalProperties": false, "required": ["artifact_path", "sha256", "input_sha256", "profile_sha256", "model_sha256", "settings_sha256"], "properties": {
        "artifact_path": {"type": "string", "pattern": "^(?![/.])(?!.*(^|/)\\.\\.(/|$))[^\\\\:]+$"},
        "sha256": {"type": "string", "pattern": "^[0-9a-f]{64}$"},
        "input_sha256": {"type": "string", "pattern": "^[0-9a-f]{64}$"},
        "profile_sha256": {"type": "string", "pattern": "^[0-9a-f]{64}$"},
        "model_sha256": {"type": "string", "pattern": "^[0-9a-f]{64}$"},
        "settings_sha256": {"type": "string", "pattern": "^[0-9a-f]{64}$"}
      }},
      "approved_pipeline": {"type": "string", "pattern": "^[0-9a-f]{64}$", "description": "Real-part pipeline fingerprint of the build the owner approved; set by `critter part approve`."}
    }}
  },
  "allOf": [{
    "if": {"properties": {"category": {"const": "connector"}}, "required": ["category"]},
    "then": {"required": ["size_class", "connector"]}
  }],
  "$defs": {"vec3": {"type": "array", "items": {"type": "number"}, "minItems": 3, "maxItems": 3}}
}
